Movie Title,Related Movie Title,Wikipedia URL,YouTube URL,Description
Goodfellas,The Silence of the Lambs,http://en.wikipedia.org/wiki/The_Silence_of_the_Lambs_(film),https://www.youtube.com/watch?v=W6Mm8Sbe__o,"F.B.I. trainee Clarice Starling (Jodie Foster) works hard to advance her career, while trying to hide or put behind her West Virginia roots, of which if some knew, would automatically classify her as being backward or white trash. After graduation, she aspires to work in the agency's Behavioral Science Unit under the leadership of Jack Crawford (Scott Glenn). While she is still a trainee, Crawford asks her to question Dr. Hannibal Lecter (Sir Anthony Hopkins), a psychiatrist imprisoned, thus far, for eight years in maximum security isolation for being a serial killer who cannibalized his victims. Clarice is able to figure out the assignment is to pick Lecter's brains to help them solve another serial murder case, that of someone coined by the media as ""Buffalo Bill"" (Ted Levine), who has so far killed five victims, all located in the eastern U.S., all young women, who are slightly overweight (especially around the hips), all who were drowned in natural bodies of water, and all who were stripped of large swaths of skin. She also figures that Crawford chose her, as a woman, to be able to trigger some emotional response from Lecter. After speaking to Lecter for the first time, she realizes that everything with him will be a psychological game, with her often having to read between the very cryptic lines he provides. She has to decide how much she will play along, as his request in return for talking to him is to expose herself emotionally to him. The case takes a more dire turn when a sixth victim is discovered, this one from who they are able to retrieve a key piece of evidence, if Lecter is being forthright as to its meaning. A potential seventh victim is high profile Catherine Martin (Brooke Smith), the daughter of Senator Ruth Martin (Diane Baker), which places greater scrutiny on the case as they search for a hopefully still alive Catherine. Who may factor into what happens is Dr. Frederick Chilton (Anthony Heald), the warden at the prison, an opportunist who sees the higher profile with Catherine, meaning a higher profile for himself if he can insert himself successfully into the proceedings."
Goodfellas,Heroic Losers,https://en.wikipedia.org/wiki/Heroic_Losers,https://www.youtube.com/watch?v=ZP_o6GQaFW8,"August 2001, Alsina (east to Argentina, close to Atlantic Ocean). In a little town with absence of population and resources, former soccer player Fermín Pelassi and his wife Lidia decide to create a cooperative buying an abandoned silo to restore it and hire people to work, hoping to bring back the business Alsina. Talking between others with friends as aged Antonio Fontana (a self-declared anarchist and Bakunin's fan), train station chief Rolo Belaúnde, redneck expert in explosives Atanasio Medina, businesswoman Carmen Largio and the naive not-too-much-smart but lovely José and Eladio Gómez brothers, all they reunite an amount of 158,000 $. Not having a bank in Alsina, Fermín and Lidia travel the neighbor town of Villagrán to leave the money in a safe box trusting in Alvarado, bank manager, to keep it while they try to negotiate with silo's owner to reduce the original price of 300,000 $. Therefore, Alvarado convinces Fermín to change the money from the safe box to his own bank account to accelerate silo's purchase. But the next day, December 19, 2001, Argentina's government declares the infamous Corralito (a national bank freeze, preventing that any citizen can to extract from any bank more of 250 $ per day). With all them money trapped in the bank, Fermín and Lidia travel Villagrán to face without success Alvarado by the cheat. However, things worsen when during the return trip they have a car crash, where Lidia dies and Fermín is severally injured. One year later, a depressive and still mourning Fermín cared by his son Rodrigo, who left the Buenos Aires' University after the car crash, is visited by Fontana and Belaúnde to report him about news: going to Fontana's workshop, a young bank employee reveals Fermín that the same day that Alvarado convinced him to change the money, it was moved to the bank account of a corrupt lawyer and Alvavaro's partner-in-crime, Fortunato Manzi, who later kept it in an underground bunker located in the lands of a cow ranch. Looking for recover the money Rodrigo fakes to be a gardener in Manzi's office where he meets Florencia, Manzi's secretary, feeling attracted to her at the same time he learns about Alvarado's and his wife deaths in a fire in their house. While Fermín and the rest find the bunker and they try to open it, they discover in bad ways the so much strong bunker's security system, forced to runaway quickly. Tracing trace a plan to dismantle the security causing several consecutive fails on it, two unexpected troubles appear: Florencia uncovers Rodrigo, and an armed Manzi is on the verge of a collapse nervous, determined to kill anyone by the money. Fearing to lose Rodrigo as he lost Lidia, Fermín quits off the plan, but Rodrigo makes him continue despite the danger. Will can to get the money before Florencia betrays Rodrigo and Manzi catch all them?"
Goodfellas,Adu,https://en.wikipedia.org/wiki/Ad%C3%BA,https://www.youtube.com/watch?v=FxQ7Y3mgfec,"In the coastal autonomous city of Melilla (located in north Africa but belonging Spain), Mateo is a Civil Guard with the task to protect the barb wire which divides the city of the rest of Africa to avoid the entering of African immigrants to Spain. During a mass attempt a night, Mateo is witness about as his partner Javi hits with his club in the head to an immigrant named Tatu, falling of the barb wire to the ground and dying in the fall, causing the rage in the rest of immigrants that seen it. At the same time, in a reservation of Mbouma, Cameroon, Gonzalo is a Spaniard working as external advisor to prevent the killing of elephants by poachers, who arrives too much late to save the most important elephant of the reservation. Unaware for him, this killing causes that the child Alika and his younger brother Adu be forced to flee from their little town in Mbouma pursued by poachers, after that they were accidental witnesses of the killing. While in Melilla Mateo doubts between saying the truth about what happened or keeping silence to protect Javi, Gonzalo is fired of his job after a discussion with the reservation's guards and he moves to the airport to meet Sandra, his longtime stranded daughter (a lover of alcohol, drugs, party and wild side of life) who still continues resentful with her father after he left she and her mother when Sandra was a child, forced to move with Gonzalo after some troubles in Madrid (center to Spain and country's capital). Hoping to arrive Spain to meet with their father, Alika and Adu take a flight as stowaways hiding them in the undercarriage, but Alika dies by frozen and falls to the sea when the plane opens the undercarriage to take land, leaving alone to Adu who by mistake arrives Mauritania. While Mateo is visited by Tatu's lawyer Paloma trying to convince him to be honest in Javi's trial, Gonzalo tries to save Sandra of her self-destructive spiral of addictions to reconcile each other, and Adu is saved of the police by the teenager Massar who decides to care Adu as his new older brother for traveling Spain by offering sexually himself to truck drivers in order to earn money for finally arriving mount Gurugu, makeshift camp close to Melilla where immigrants await the right moment to pass the border, not knowing that their paths will cross with Mateo and Gonzalo in the most unexpected ways."
Goodfellas,Dying of Laughter,https://en.wikipedia.org/wiki/Dying_of_Laughter,https://www.youtube.com/watch?v=4mWZeIgMO68,"Nino and Bruno are two comedians who reach the heights of success with their duo act, turning them into huge TV celebrities. However, the hate between them grows as fast, and as much, as their fame."
Goodfellas,Forrest Gump,http://en.wikipedia.org/wiki/Forrest_Gump,https://www.youtube.com/watch?v=bLvqoHBptjg,"Forrest Gump is a simple man with a low I.Q. but good intentions. He is running through childhood with his best and only friend Jenny. His 'mama' teaches him the ways of life and leaves him to choose his destiny. Forrest joins the army for service in Vietnam, finding new friends called Dan and Bubba, he wins medals, creates a famous shrimp fishing fleet, inspires people to jog, starts a ping-pong craze, creates the smiley, writes bumper stickers and songs, donates to people and meets the president several times. However, this is all irrelevant to Forrest who can only think of his childhood sweetheart Jenny Curran, who has messed up her life. Although in the end all he wants to prove is that anyone can love anyone."
Goodfellas,Casino,http://en.wikipedia.org/wiki/Casino_(movie),https://www.youtube.com/watch?v=EJXDMwGWhoA,"This Martin Scorsese film depicts the Janus-like quality of Las Vegas--it has a glittering, glamorous face, as well as a brutal, cruel one. Ace Rothstein and Nicky Santoro, mobsters who move to Las Vegas to make their mark, live and work in this paradoxical world. Seen through their eyes, each as a foil to the other, the details of mob involvement in the casinos of the 1970s and '80s are revealed. Ace is the smooth operator of the Tangiers casino, while Nicky is his boyhood friend and tough strongman, robbing and shaking down the locals. However, they each have a tragic flaw--Ace falls in love with a hustler, Ginger, and Nicky falls into an ever-deepening spiral of drugs and violence."
Goodfellas,Scarface,http://en.wikipedia.org/wiki/Scarface_(1983_movie),https://www.youtube.com/watch?v=7pQQHnqBa2E,"Tony Montana manages to leave Cuba during the Mariel exodus of 1980. He finds himself in a Florida refugee camp but his friend Manny has a way out for them: undertake a contract killing and arrangements will be made to get a green card. He's soon working for drug dealer Frank Lopez and shows his mettle when a deal with Colombian drug dealers goes bad. He also brings a new level of violence to Miami. Tony is protective of his younger sister but his mother knows what he does for a living and disowns him. Tony is impatient and wants it all however, including Frank's empire and his mistress Elvira Hancock. Once at the top however, Tony's outrageous actions make him a target and everything comes crumbling down."
Goodfellas,The Invisible Guest,https://en.wikipedia.org/wiki/The_Invisible_Guest,https://www.youtube.com/watch?v=epCg2RbyF80,"Adrián Doria, a wealthy businessman named Man of the Year due to his high-tech company and his trade agreements with the Asian market, meets Virginia Goodman, a veteran lawyer expert in witness preparation and judicial declaration, recommended by Adrián's lawyer Felix Leiva in order to create a credible defense. Arrested by the police in a mountain hotel room with the corpse of his lover at his side, photographer Laura Vidal, Adrián talks Virginia about the crime and his relationship with Laura, revealing that both suffered a car crash where a man called Daniel Garrido died, and how Laura manipulated Adrián to avoid the jail by Daniel's death. At the same time that Félix is looking for a clue that it could change the course of the events, Virginia and Adrián keep talking about the case but her, unconvinced of the Adrián's testimony, forces him to clear the dark points of his history, in a puzzle where the truth and the lie are easily exchangeable."
Goodfellas,No Country for Old Men,http://en.wikipedia.org/wiki/No_Country_for_Old_Men_(film),https://www.youtube.com/watch?v=38A__WT3-o0,"In rural Texas, welder and hunter Llewelyn Moss ("
Goodfellas,The Weasel's Tale,https://en.wikipedia.org/wiki/List_of_2019_box_office_number-one_films_in_Argentina,https://www.youtube.com/watch?v=eDTKTjQadWU,"A group of four old friends conformed by a film director, a film writer, an actress and her husband share a big house in the country. Their coexistence is menaced by a young couple who resourcefully and deceitfully seek to get them to sell the house to develop a real estate project of their own."
Goodfellas,Everybody Knows,https://en.wikipedia.org/wiki/Everybody_Knows_(film),https://www.youtube.com/watch?v=L68mUxKuAnA,"Laura, a Spanish woman living in Buenos Aires, returns to her hometown outside Madrid with her two children to attend her sister's wedding. However, the trip is upset by unexpected events that bring secrets into the open."
Goodfellas,Léon: The Professional,http://en.wikipedia.org/wiki/L%C3%A9on:_The_Professional,https://www.youtube.com/watch?v=jawVxq1Iyl0,"After her father, step-mother, step-sister and little brother are killed by her father's employers, the 12-year-old daughter of an abject drug dealer manages to take refuge in the apartment of a professional hitman who at her request teaches her the methods of his job so she can take her revenge on the corrupt DEA agent who ruined her life by killing her beloved brother."
Goodfellas,Crazy About Her,https://en.wikipedia.org/wiki/Crazy_About_Her_(film),https://www.youtube.com/watch?v=BYHR0EYLWj8,"After a magical night together, Adri voluntarily turns himself into the psychiatric institution where Carla lives."
Goodfellas,Litus.,https://es.wikipedia.org/wiki/Litus,https://www.youtube.com/watch?v=gRlDXFfnqeY,"In 2019 Madrid, 6 months after the suicide of Litus who crashed a van against a wall, his intimate circle of friends reunite in the house where he lived with one of them, Pablo, to talk about it. They are Laia, Litus' life-long girlfriend; Marcos, who lives with Pablo after he was fired from his job and who is obsessed with getting his former girlfriend Su back; Litus' older brother Toni; Pepe, who enjoys his new life as a pop star; and Su, whom Toni invited on Litus' instructions--apparently he wrote letters to all of them. But as the friends arrive at the house, troubles increase progressively: Toni and Laia announce that they're dating, to Pablo's surprise and suspicion; Pablo is still anger-theorizing whether Litus really had an accident instead of committing suicide; Marcos learns that Su is engaged to someone else; and Toni accuses Pepe of being happier with his new famous music-star status than he was when he played guitar and wrote songs with Litus. When all the letters are opened, the situation gets even more complicated, especially when Laia suggests that the letters must be false and that Litus didn't write them, a claim that not only tests their friendships and bonds, but makes them question who Litus really was and who they really are."
Goodfellas,Good Will Hunting,http://en.wikipedia.org/wiki/Good_Will_Hunting,https://www.youtube.com/watch?v=ReIJ1lbL-Q8,"A touching tale of a wayward young man who struggles to find his identity, living in a world where he can solve any problem, except the one brewing deep within himself, until one day he meets his soul mate who opens his mind and his heart."
North by Northwest,Rear Window,http://en.wikipedia.org/wiki/Rear_Window,https://www.youtube.com/watch?v=m01YktiEZCw,"Professional photographer L.B. ""Jeff"" Jefferies breaks his leg while getting an action shot at an auto race. Confined to his New York apartment, he spends his time looking out of the rear window observing the neighbors. He begins to suspect that a man across the courtyard may have murdered his wife. Jeff enlists the help of his high society fashion-consultant girlfriend Lisa Fremont and his visiting nurse Stella to investigate."
North by Northwest,Vertigo,http://en.wikipedia.org/wiki/Vertigo_(movie),https://www.youtube.com/watch?v=Z5jvQwwHQNY,"Following his early retirement as a detective from the San Francisco Police Department, John Ferguson - Scottie to his friends - becomes obsessed with two women in succession, those obsessions which trouble his long time friend and former fiancée, Midge Wood, a designer of women's undergarments. The first is wealthy and elegant platinum blonde Madeleine Elster, the wife of his college acquaintance Gavin Elster, who hires John to follow her in Gavin's belief that she may be a danger to herself in thinking that she has recently been possessed by the spirit of Carlotta Valdes, Madeleine's great-grandmother who she knows nothing about, but who Gavin knows committed suicide in being mentally unbalanced when she was twenty-six, Madeleine's current age. The second is Judy Barton, who John spots on the street one day. Judy is a working class girl, but what makes John obsessed with her is that, despite her working class style and her brunette hair, she is the spitting image of Madeleine, into who he tries to transform Judy. The initial question that John has is if there is some connection between Madeleine and Judy. What happens between John and individually with Madeleine and Judy is affected by the reason John took that early retirement: a recent workplace incident that showed that he is acrophobic which leads to a severe case of vertigo whenever he looks down from tall heights."
North by Northwest,Rebecca,http://en.wikipedia.org/wiki/Rebecca_(movie),https://www.youtube.com/watch?v=8YqFImp2xx8,"A shy lady's companion, staying in Monte Carlo with her stuffy employer, meets the wealthy Maxim de Winter (Sir Laurence Olivier). She and Max fall in love, marry, and return to Manderley, his large country estate in Cornwall. Max is still troubled by the death of his first wife, Rebecca, in a boating accident the year before. The second Mrs. de Winter (Joan Fontaine) clashes with the housekeeper, Mrs. Danvers (Dame Judith Anderson), and discovers that Rebecca still has a strange hold on everyone at Manderley."
North by Northwest,Chinatown,http://en.wikipedia.org/wiki/Chinatown_(1974_movie),https://www.youtube.com/watch?v=p39LFdGI-YA,"In 1937 Los Angeles, private investigator Jake 'J.J.' Gittes specializes in cheating-spouse cases. His current target is Hollis Mulwray, high-profile chief engineer for the Los Angeles Department of Water and Power, whose wife suspects him of infidelity. In following Mulwray, Gittes witnesses some usual business dealings, such as a public meeting for construction of a new dam to create additional water supply for Los Angeles, as fresh water is vital to the growing community during the chronic drought; Mulwray opposes the dam. Eventually Gittes sees Mulwray meeting with an unknown young woman who isn't his wife. Once news of the supposed tryst between Mulwray and this woman hits the media, additional information comes to light that makes Gittes believe that Mulwray is being framed for something and that he himself is being set up. In his investigation of the issue behind Mulwray's framing and his own setup, Gittes is assisted by Mulwray's wife Evelyn, but he thinks she isn't being forthright with him. The further he gets into the investigation, the more secrets he uncovers about the Mulwrays' professional and personal dealings, including Mulwray's former business-partnership with Evelyn's father, Noah Cross. The identity of the unknown woman may be the key to uncovering the whole story."
North by Northwest,Psycho,http://en.wikipedia.org/wiki/Psycho_(1960_film),https://www.youtube.com/watch?v=Wz719b9QUqY,"Phoenix office worker Marion Crane is fed up with the way life has treated her. She has to meet her lover Sam in lunch breaks, and they cannot get married because Sam has to give most of his money away in alimony. One Friday, Marion is trusted to bank forty thousand dollars by her employer. Seeing the opportunity to take the money and start a new life, Marion leaves town and heads towards Sam's California store. Tired after the long drive and caught in a storm, she gets off the main highway and pulls into the Bates Motel. The motel is managed by a quiet young man called Norman who seems to be dominated by his mother."
North by Northwest,Rope,https://en.wikipedia.org/wiki/Rope_(film),https://www.youtube.com/watch?v=8xkQoH8QbVs,"Brandon and Philip are two young men who share a New York City apartment. They consider themselves intellectually superior to their friend David Kentley, and as a consequence, decide to murder him. Together they strangle David with a rope and placing the body in an old chest, they proceed to hold a small party. The guests include David's father, his fiancée Janet, and their old schoolteacher Rupert, from whom they mistakenly took their ideas. As Brandon becomes increasingly more daring, Rupert begins to suspect."
North by Northwest,The Man Who Knew Too Much,http://en.wikipedia.org/wiki/The_Man_Who_Knew_Too_Much_(1956_film),https://www.youtube.com/watch?v=a-KyhUNtlas,"While attending a medical conference in Paris, American physician Dr. Ben McKenna, his wife, retired musical theater actress and singer Jo McKenna née Conway, and their adolescent son Hank McKenna decide to take a side trip to among other places Marrekesh, French Morocco. With a knife plunged into his back, Frenchman Louis Bernard, who the family met earlier in their bus ride into Marrakesh and who is now masquerading as an Arab, approaches Ben, cryptically whispering into Ben's ears that there will be an attempted assassination in London of a statesman, this news whispered just before Bernard dies. Ben is reluctant to provide any information of this news to the authorities because concurrently Hank is kidnapped by British couple, Edward and Lucy Drayton, who also befriended the McKennas in Marrakesh and who probably have taken Hank out of the country back to England. Whoever the unknown people the Draytons are working for have threatened to kill Hank if Ben divulges any information told to him by Bernard. With what little information they have on hand, Ben and Jo head to London to try and thwart the assassination attempt and more importantly find an alive and safe Hank. Scotland Yard is aware of some pieces to the puzzle, including the fact that Bernard was a French secret service agent and that there will be an assassination attempt on someone. They and the McKennas will have to work together as they hit a diplomatic roadblock, one that may be overcome with a special Jo Conway song."
North by Northwest,Dial M for Murder,http://en.wikipedia.org/wiki/Dial_M_for_Murder,https://www.youtube.com/watch?v=JWP_hrNHSN4,"In London, wealthy Margot Mary Wendice had a brief love affair with the American writer Mark Halliday while her husband and professional tennis player Tony Wendice was on a tennis tour. Tony quits playing to dedicate to his wife and finds a regular job. She decides to give him a second chance for their marriage. When Mark arrives from America to visit the couple, Margot tells him that she had destroyed all his letters but one that was stolen. Subsequently she was blackmailed, but she had never retrieved the stolen letter. Tony arrives home, claims that he needs to work and asks Margot to go with Mark to the theater. Meanwhile Tony calls Captain Lesgate (aka Charles Alexander Swann who studied with him at college) and blackmails him to murder his wife, so that he can inherit her fortune. But there is no perfect crime, and things do not work as planned."
North by Northwest,Witness for the Prosecution,https://en.wikipedia.org/wiki/Witness_for_the_Prosecution_(1957_film),https://www.youtube.com/watch?v=GMlJfiA2u7Y,"Ailing barrister Sir Wilfrid Robarts is thrust back into the courtroom in what becomes one of the most unusual and eventful murder case of the lawyer's career when he finds himself defending Leonard Vole, a man being tried for the murder of a wealthy woman. With Robarts choosing to represent him, the two find themselves up against Leonard's cold-hearted wife, Christine - who, in a surprising turn of events, chooses to appear in court against her husband."
North by Northwest,Strangers on a Train,http://en.wikipedia.org/wiki/Strangers_on_a_Train_(film),https://www.youtube.com/watch?v=J1iSS5r0OVE,"Bruno Antony thinks he has the perfect plot to rid himself of his hated father, and when he meets tennis player Guy Haines on a train he thinks he's found the partner he needs to pull it off. His plan is relatively simple: Two strangers each agree to kill someone the other person wants gone. For example, Guy could kill his father and he could get rid of Guy's wife Miriam, freeing him to marry Anne Morton, the beautiful daughter of a U.S. Senator. Guy dismisses it all out of hand, but Bruno goes ahead with his half of the ""bargain"" and disposes of Miriam. When Guy balks, Bruno makes it clear that he will plant evidence to implicate Guy in her murder if he doesn't get rid of his father. Guy had also made some unfortunate statements about Miriam after she had refused to divorce him. It all leads the police to believe Guy is responsible for the murder, forcing him to deal with Bruno's mad ravings."
