Movie Title,Related Movie Title,Wikipedia URL,YouTube URL,Description
Pulp Fiction,Kill Bill: Vol. 2,http://en.wikipedia.org/wiki/Kill_Bill_Volume_2,https://www.youtube.com/watch?v=WTt8cCIvGYI,"The murderous Bride is back and she is still continuing her vengeance quest against her ex-boss, Bill, and taking aim at Bill's younger brother Budd and Elle Driver, the only survivors from the squad of assassins who betrayed her four years earlier. It's all leading up to the ultimate confrontation with Bill, the Bride's former master and the man who ordered her execution!"
Pulp Fiction,Casino,http://en.wikipedia.org/wiki/Casino_(movie),https://www.youtube.com/watch?v=EJXDMwGWhoA,"This Martin Scorsese film depicts the Janus-like quality of Las Vegas--it has a glittering, glamorous face, as well as a brutal, cruel one. Ace Rothstein and Nicky Santoro, mobsters who move to Las Vegas to make their mark, live and work in this paradoxical world. Seen through their eyes, each as a foil to the other, the details of mob involvement in the casinos of the 1970s and '80s are revealed. Ace is the smooth operator of the Tangiers casino, while Nicky is his boyhood friend and tough strongman, robbing and shaking down the locals. However, they each have a tragic flaw--Ace falls in love with a hustler, Ginger, and Nicky falls into an ever-deepening spiral of drugs and violence."
The Truman Show,Back to the Future,http://en.wikipedia.org/wiki/Back_to_the_Future,https://www.youtube.com/watch?v=qvsgGtivCgs,"Marty McFly, a typical American teenager of the Eighties, is accidentally sent back to 1955 in a plutonium-powered DeLorean ""time machine"" invented by a slightly mad scientist. During his often hysterical, always amazing trip back in time, Marty must make certain his teenage parents-to-be meet and fall in love - so he can get back to the future."
The Truman Show,Inception,https://en.wikipedia.org/wiki/Inception,https://www.youtube.com/watch?v=YoHD9XEInc0,"Dom Cobb is a skilled thief, the absolute best in the dangerous art of extraction, stealing valuable secrets from deep within the subconscious during the dream state, when the mind is at its most vulnerable. Cobb's rare ability has made him a coveted player in this treacherous new world of corporate espionage, but it has also made him an international fugitive and cost him everything he has ever loved. Now Cobb is being offered a chance at redemption. One last job could give him his life back but only if he can accomplish the impossible, inception. Instead of the perfect heist, Cobb and his team of specialists have to pull off the reverse: their task is not to steal an idea, but to plant one. If they succeed, it could be the perfect crime. But no amount of careful planning or expertise can prepare the team for the dangerous enemy that seems to predict their every move. An enemy that only Cobb could have seen coming."
The Truman Show,V for Vendetta,http://en.wikipedia.org/wiki/V_for_Vendetta_(film),https://www.youtube.com/watch?v=lSA7mAHolAw,"In the distant future, Evey Hammond is an average citizen of the United Kingdom, which is under the rule of the fascist and tyrannical Norsefire Party. She is an employee of the state-run British Television Network, but soon, she becomes the number one enemy of the state together with an enigmatic and larger-than-life freedom fighter known only by the letter ""V"". V informs Evey that she must hide in his underground lair for at least one year, and while she is reluctant to the idea at first, a bond soon forms between the two individuals. In the meanwhile, the mysterious past of V is gradually revealed to the police inspector tasked with capturing him, Eric Finch, and it is not long until he starts questioning everything his government stands for."
The Truman Show,The Matrix,http://en.wikipedia.org/wiki/The_Matrix,https://www.youtube.com/watch?v=vKQi3bBA1y8,"Thomas A. Anderson is a man living two lives. By day he is an average computer programmer and by night a hacker known as Neo. Neo has always questioned his reality, but the truth is far beyond his imagination. Neo finds himself targeted by the police when he is contacted by Morpheus, a legendary computer hacker branded a terrorist by the government. As a rebel against the machines, Neo must confront the agents: super-powerful computer programs devoted to stopping Neo and the entire human rebellion."
The Truman Show,2001: A Space Odyssey,http://en.wikipedia.org/wiki/2001:_A_Space_Odyssey_(film),https://www.youtube.com/watch?v=oR_e9y-bka0,"""2001"" is a story of evolution. Sometime in the distant past, someone or something nudged evolution by placing a monolith on Earth (presumably elsewhere throughout the universe as well). Evolution then enabled humankind to reach the moon's surface, where yet another monolith is found, one that signals the monolith placers that humankind has evolved that far. Now a race begins between computers (HAL) and human (Bowman) to reach the monolith placers. The winner will achieve the next step in evolution, whatever that may be."
The Truman Show,Interstellar,http://en.wikipedia.org/wiki/Interstellar_(film),https://www.youtube.com/watch?v=zSWdZVtXT7E,"Earth's future has been riddled by disasters, famines, and droughts. There is only one way to ensure mankind's survival: Interstellar travel. A newly discovered wormhole in the far reaches of our solar system allows a team of astronauts to go where no man has gone before, a planet that may have the right environment to sustain human life."
The Truman Show,Back to the Future Part II,http://en.wikipedia.org/wiki/Back_to_the_Future_Part_II,https://www.youtube.com/watch?v=MdENmefJRpw,"Marty McFly has only just gotten back from the past, when he is once again picked up by Dr. Emmett Brown and sent through time to the future. Marty's job in the future is to pose as his own son to prevent him from being thrown in prison. Unfortunately, things get worse when the future changes the present."
The Truman Show,Terminator 2: Judgment Day,http://en.wikipedia.org/wiki/Terminator_2:_Judgment_Day,https://www.youtube.com/watch?v=CRRlbK5w8AE,"Over 10 years have passed since the first machine called The Terminator tried to kill Sarah Connor and her unborn son, John. The man who will become the future leader of the human resistance against the Machines is now a healthy young boy. However, another Terminator, called the T-1000, is sent back through time by the supercomputer Skynet. This new Terminator is more advanced and more powerful than its predecessor and its mission is to kill John Connor when he's still a child. However, Sarah and John do not have to face the threat of the T-1000 alone. Another Terminator (identical to the same model that tried and failed to kill Sarah Connor in 1984) is also sent back through time to protect them. Now, the battle for tomorrow has begun."
The Truman Show,Free Guy,https://en.wikipedia.org/wiki/Free_Guy,https://www.youtube.com/watch?v=X2m-08cOAbc,"In the extremely popular video game, Free City, a NPC named Guy learns the true nature of his existence when he meets the girl of his dreams, a human player. This player's interactions with Guy has massive affects on him, the game, and real world as they play it."
The Truman Show,Eternal Sunshine of the Spotless Mind,http://en.wikipedia.org/wiki/Eternal_Sunshine_of_the_Spotless_Mind,https://www.youtube.com/watch?v=07-QBnEkgXU,"Much to his surprise, timid Joel Barish is shocked to discover that the love of his life, sparky Clementine, has had him erased from her memory. To pay her back in the same coin, poor Joel summons up the courage to undergo a painless but intricate medical procedure to do the same, utterly unaware that darkness is an essential part of the light. Now, as hurt and angry Joel's ugly recollections of Clementine gradually fade away, giving way to a soulless black void, suddenly, he begins having second thoughts, toying with the idea of stopping the irreversible process. In the end, is ignorance really bliss?"
The Truman Show,The Terminator,http://en.wikipedia.org/wiki/The_Terminator,https://www.youtube.com/watch?v=k64P4l2Wmeg,"Sent back from a dystopian 2029--where the cold machines have conquered the entire world--to 1984 Los Angeles, the indestructible cyborg-assassin known as the ""Terminator"" commences his deadly mission to kill humankind's most important woman: the unsuspecting Sarah Connor. However, from the same war-torn post-apocalyptic future comes a battle-scarred defender--Kyle Reese, a brave soldier of the human Resistance Army--bent on stopping the cybernetic killer from eliminating the world's last hope. But, the Terminator has no feelings, he doesn't sleep, and above all, he won't stop until he carries out his grim task. Does our future lie in our past?"
The Truman Show,The Suicide Squad,https://en.wikipedia.org/wiki/The_Suicide_Squad_(film),https://www.youtube.com/watch?v=JuDLepNa7hw,"In exchange for lighter sentences, just like the anti-hero team in"
The Truman Show,Jurassic Park,http://en.wikipedia.org/wiki/Jurassic_Park_(film),https://www.youtube.com/watch?v=QWBKEmWWL38,"Huge advancements in scientific technology have enabled a mogul to create an island full of living dinosaurs. John Hammond has invited four individuals, along with his two grandchildren, to join him at Jurassic Park. But will everything go according to plan? A park employee attempts to steal dinosaur embryos, critical security systems are shut down and it now becomes a race for survival with dinosaurs roaming freely over the island."
The Truman Show,Dune: Part One,https://en.wikipedia.org/wiki/Dune_(2021_film),https://www.youtube.com/watch?v=8g18jFHCLXk,"A mythic and emotionally charged hero's journey, ""Dune"" tells the story of Paul Atreides, a brilliant and gifted young man born into a great destiny beyond his understanding, who must travel to the most dangerous planet in the universe to ensure the future of his family and his people. As malevolent forces explode into conflict over the planet's exclusive supply of the most precious resource in existence-a commodity capable of unlocking humanity's greatest potential-only those who can conquer their fear will survive."
The Truman Show,The Prestige,http://en.wikipedia.org/wiki/The_Prestige_(film),https://www.youtube.com/watch?v=RLtaA9fFNXU,"In the end of the nineteenth century, in London, Robert Angier, his beloved wife Julia McCullough, and Alfred Borden are friends and assistants of a magician. When Julia accidentally dies during a performance, Robert blames Alfred for her death, and they become enemies. Both become famous and rival magicians, sabotaging the performance of the other on the stage. When Alfred performs a successful trick, Robert becomes obsessed trying to disclose the secret of his competitor with tragic consequences."
The Truman Show,12 Monkeys,http://en.wikipedia.org/wiki/12_Monkeys,https://www.youtube.com/watch?v=15s4Y9ffW_o,"James Cole, a prisoner of the state in the year 2035, can earn parole if he agrees to travel back in time and thwart a devastating plague. The virus has wiped out most of the Earth's population and the remainder live underground because the air is poisonous. Returning to the year 1990, six years before the start of the plague, Cole is soon imprisoned in a psychiatric facility because his warnings sound like mad ravings. There he meets a scientist named Dr. Kathryn Railly and Jeffrey Goines, the mad son of an eminent virologist. Cole is returned by the authorities to the year 2035, and finally ends up at his intended destination in 1996. He kidnaps Dr. Railly in order to enlist her help in his quest. Cole discovers graffiti by an apparent animal rights group called the Army of the Twelve Monkeys, but as he delves into the mystery, he hears voices, loses his bearings, and doubts his own sanity. He must figure out if Goines, who seems to be a raving lunatic, holds the key to the puzzle."
The Truman Show,Avengers: Endgame,https://en.wikipedia.org/wiki/Avengers:_Endgame,https://www.youtube.com/watch?v=TcMBFSGVi1c,"After the devastating events of Avengers: Infinity War (2018), the universe is in ruins due to the efforts of the Mad Titan, Thanos. With the help of remaining allies, the Avengers must assemble once more in order to undo Thanos's actions and undo the chaos to the universe, no matter what consequences may be in store, and no matter who they face..."
The Truman Show,Tenet,https://en.wikipedia.org/wiki/Tenet_(film),https://www.youtube.com/watch?v=L3pk_TBkihU,"In a twilight world of international espionage, an unnamed CIA operative, known as The Protagonist, is recruited by a mysterious organization called Tenet to participate in a global assignment that unfolds beyond real time. The mission: prevent Andrei Sator, a renegade Russian oligarch with precognition abilities, from starting World War III. The Protagonist will soon master the art of ""time inversion"" as a way of countering the threat that is to come."
The Truman Show,Star Wars: Episode IV - A New Hope,https://en.wikipedia.org/wiki/Star_Wars_(film),https://www.youtube.com/watch?v=1g3_CFmnU7k,"The Imperial Forces, under orders from cruel Darth Vader, hold Princess Leia hostage in their efforts to quell the rebellion against the Galactic Empire. Luke Skywalker and Han Solo, captain of the Millennium Falcon, work together with the companionable droid duo R2-D2 and C-3PO to rescue the beautiful princess, help the Rebel Alliance and restore freedom and justice to the Galaxy."
The Truman Show,Blade Runner,https://en.wikipedia.org/wiki/Blade_Runner,https://www.youtube.com/watch?v=eogpIG53Cis,"In the early twenty-first century, the Tyrell Corporation, during what was called the Nexus phase, developed robots, called ""replicants"", that were supposed to aid society, the replicants which looked and acted like humans. When the superhuman generation Nexus 6 replicants, used for dangerous off-Earth endeavors, began a mutiny on an off-Earth colony, replicants became illegal on Earth. Police units, called ""blade runners"", have the job of destroying - or in their parlance ""retiring"" - any replicant that makes its way back to or created on Earth, with anyone convicted of aiding or assisting a replicant being sentenced to death. It's now November, 2019 in Los Angeles, California. Rick Deckard, a former blade runner, is called out of retirement when four known replicants, most combat models, have made their way back to Earth, with their leader being Roy Batty. One, Leon Kowalski, tried to infiltrate his way into the Tyrell Corporation as an employee, but has since been able to escape. Beyond following Leon's trail in hopes of finding and retiring them all, Deckard believes part of what will help him is figuring out what the replicants wanted with the Tyrell Corporation in trying to infiltrate it. The answer may lie with Tyrell's fail-safe backup mechanism. Beyond tracking the four, Deckard faces a possible dilemma in encountering a fifth replicant: Rachael, who works as Tyrell's assistant. The issue is that Dr. Elden Tyrell is experimenting with her, to provide her with fake memories so as to be able to better control her. With those memories, Rachael has no idea that she is not human. The problem is not only Rachael's assistance to Deckard, but that he is beginning to develop feelings for her."
Lawrence of Arabia,The Bridge on the River Kwai,http://en.wikipedia.org/wiki/The_Bridge_on_the_River_Kwai,https://www.youtube.com/watch?v=RlC7XBayj0s,"During WW II, allied POWs in a Japanese internment camp are ordered to build a bridge to accommodate the Burma-Siam railway. Their instinct is to sabotage the bridge, but under the leadership of Colonel Nicholson they're persuaded the bridge should be built to help morale, spirit. At first, the prisoners admire Nicholson when he bravely endures torture rather than compromise his principles for the benefit of Japanese Commandant Colonel Saito, but soon they realise it's a monument to Nicholson, himself, as well as a form of collaboration with the enemy."
Lawrence of Arabia,Ben-Hur,https://en.wikipedia.org/wiki/Ben-Hur_(1959_film),https://www.youtube.com/watch?v=NR1ZHKw09n8,"Judah Ben-Hur lives as a rich Jewish prince and merchant in Jerusalem at the beginning of the 1st century. Together with the new governor his old friend Messala arrives as commanding officer of the Roman legions. At first they are happy to meet after a long time but their different politic views separate them. During the welcome parade a roof tile falls down from Judah's house and injures the governor. Although Messala knows they are not guilty, he sends Judah to the galleys and throws his mother and sister into prison. But Judah swears to come back and take revenge."
Lawrence of Arabia,Platoon,http://en.wikipedia.org/wiki/Platoon_(movie),https://www.youtube.com/watch?v=KztP7SKe0uk,"Chris Taylor is a young, naive American who gives up college and volunteers for combat in Vietnam. Upon arrival, he quickly discovers that his presence is quite nonessential, and is considered insignificant to the other soldiers, as he has not fought for as long as the rest of them and felt the effects of combat. Chris has two non-commissioned officers, the ill-tempered and indestructible Staff Sergeant Robert Barnes and the more pleasant and cooperative Sergeant Elias Grodin. A line is drawn between the two NCOs and a number of men in the platoon when an illegal killing occurs during a village raid. As the war continues, Chris himself draws towards psychological meltdown. And as he struggles for survival, he soon realizes he is fighting two battles, the conflict with the enemy and the conflict between the men within his platoon."
Lawrence of Arabia,Doctor Zhivago,http://en.wikipedia.org/wiki/Doctor_Zhivago_(film),https://www.youtube.com/watch?v=CGGr21PilKY,"During the Russian Revolution, Dr. Yuri Zhivago (Omar Sharif) is a young doctor who has been raised by his aunt and uncle following his father's suicide. Yuri falls in love with beautiful Lara Guishar (Julie Christie), who has been having an affair with her mother's lover, Victor Komarovsky (Rod Steiger), an unscrupulous businessman. Yuri, however, ends up marrying his cousin, Tonya (Geraldine Chaplin). But when he and Lara meet again years later, the spark of love reignites."
Lawrence of Arabia,Patton,http://en.wikipedia.org/wiki/Patton_(film),https://www.youtube.com/watch?v=PfERYCjm4Is,"""Patton"" tells the tale of General"
Lawrence of Arabia,The Deer Hunter,http://en.wikipedia.org/wiki/The_Deer_Hunter,https://www.youtube.com/watch?v=3Gqit3zVmyc,"Michael, Steven and Nicky are 3 best friends who enjoy going deer hunting quite often. These men get enlisted to head to Vietnam to fight for their country and celebrate with a farewell party, as well as Steven marrying a pregnant woman named ""Angela."" After the horrors during the war and edge-grabbing games of Russian Roulette that these men are forced to play, Michael returns home and realizes that his deer hunting outings aren't the same as they used to be, because of the war and he eventually finds out that Steven is handicapped and Nicky hasn't returned from Vietnam, and in response, he heads back to Vietnam to rescue him."
Lawrence of Arabia,Amadeus,http://en.wikipedia.org/wiki/Amadeus_(film),https://www.youtube.com/watch?v=r7kWQj9FCGY,
Lawrence of Arabia,The Great Escape,http://en.wikipedia.org/wiki/The_Great_Escape_(film),https://www.youtube.com/watch?v=r9Q_WESQUVw,"Based on a true story, a group of allied escape artist-type prisoners-of-war are all put in an ""escape proof"" camp. Their leader decides to try to take out several hundred all at once. The first half of the movie is played for comedy, as the prisoners mostly outwit their jailers to dig the escape tunnel. The second half is high adventure as they use planes, trains, and boats to get out of occupied Europe."
Lawrence of Arabia,Judgment at Nuremberg,http://en.wikipedia.org/wiki/Judgment_at_Nuremberg,https://www.youtube.com/watch?v=RfOgZXIQ6fo,"It has been three years since the most important Nazi leaders had already been tried. This trial is about 4 judges who used their offices to conduct Nazi sterilization and cleansing policies. Retired American judge, Dan Haywood has a daunting task ahead of him. The Cold War is heating up and no one wants any more trials as Germany, and Allied governments, want to forget the past. But is that the right thing to do is the question that the tribunal must decide."
Lawrence of Arabia,Casablanca,http://en.wikipedia.org/wiki/Casablanca_(film),https://www.youtube.com/watch?v=MF7JH_54d8c,"The story of Rick Blaine, a cynical world-weary ex-patriate who runs a nightclub in Casablanca, Morocco during the early stages of WWII. Despite the pressure he constantly receives from the local authorities, Rick's cafe has become a kind of haven for refugees seeking to obtain illicit letters that will help them escape to America. But when Ilsa, a former lover of Rick's, and her husband, show up to his cafe one day, Rick faces a tough challenge which will bring up unforeseen complications, heartbreak and ultimately an excruciating decision to make."
Lawrence of Arabia,Gone with the Wind,http://en.wikipedia.org/wiki/Gone_with_the_Wind_(film),https://www.youtube.com/watch?v=0X94oZgJis4,"Scarlett is a woman who can deal with a nation at war, Atlanta burning, the Union Army carrying off everything from her beloved Tara, the carpetbaggers who arrive after the war. Scarlett is beautiful. She has vitality. But Ashley, the man she has wanted for so long, is going to marry his placid cousin, Melanie. Mammy warns Scarlett to behave herself at the party at Twelve Oaks. There is a new man there that day, the day the Civil War begins. Rhett Butler. Scarlett does not know he is in the room when she pleads with Ashley to choose her instead of Melanie."
Lawrence of Arabia,Apocalypse Now,http://en.wikipedia.org/wiki/Apocalypse_Now,https://www.youtube.com/watch?v=FTjG-Aux_yQ,"It is the height of the war in Vietnam, and U.S. Army Captain Willard is sent by Colonel Lucas and a General to carry out a mission that, officially, 'does not exist - nor will it ever exist'. The mission: To seek out a mysterious Green Beret Colonel, Walter Kurtz, whose army has crossed the border into Cambodia and is conducting hit-and-run missions against the Viet Cong and NVA. The army believes Kurtz has gone completely insane and Willard's job is to eliminate him. Willard, sent up the Nung River on a U.S. Navy patrol boat, discovers that his target is one of the most decorated officers in the U.S. Army. His crew meets up with surfer-type Lt-Colonel Kilgore, head of a U.S Army helicopter cavalry group which eliminates a Viet Cong outpost to provide an entry point into the Nung River. After some hair-raising encounters, in which some of his crew are killed, Willard, Lance and Chef reach Colonel Kurtz's outpost, beyond the Do Lung Bridge. Now, after becoming prisoners of Kurtz, will Willard & the others be able to fulfill their mission?"
Lawrence of Arabia,Spartacus,https://en.wikipedia.org/wiki/Spartacus_(film),https://www.youtube.com/watch?v=HcIMY1Ah3aw,"In 73 B.C., a Thracian slave leads a revolt at a gladiatorial school run by Lentulus Batiatus (Sir Peter Ustinov). The uprising soon spreads across the Italian Peninsula involving thousand of slaves. The plan is to acquire sufficient funds to acquire ships from Silesian pirates who could then transport them to other lands from Brandisium in the south. The Roman Senator Gracchus (Charles Laughton) schemes to have Marcus Publius Glabrus (John Dall), Commander of the garrison of Rome, lead an army against the slaves who are living on Vesuvius. When Glabrus is defeated his mentor, Senator and General Marcus Licinius Crassus (Sir Laurence Olivier) is greatly embarrassed and leads his own army against the slaves. Spartacus and the thousands of freed slaves successfully make their way to Brandisium only to find that the Silesians have abandoned them. They then turn north and must face the might of Rome."
Lawrence of Arabia,The Elephant Man,https://en.wikipedia.org/wiki/The_Elephant_Man_(film),https://www.youtube.com/watch?v=ZvJuJKOmZAY,"In Victorian London, Dr."
Lawrence of Arabia,The Best Years of Our Lives,http://en.wikipedia.org/wiki/The_Best_Years_of_Our_Lives,https://www.youtube.com/watch?v=1yc5PugV4mk,"The story concentrates on the social re-adjustment of three World War II servicemen, each from a different station of society. Al Stephenson returns to an influential banking position, but finds it hard to reconcile his loyalties to ex-servicemen with new commercial realities. Fred Derry is an ordinary working man who finds it difficult to hold down a job or pick up the threads of his marriage. Having had both hands burnt off during the war, Homer Parrish is unsure that his fiancée's feelings are still those of love and not those of pity. Each of the veterans faces a crisis upon his arrival, and each crisis is a microcosm of the experiences of many American warriors who found an alien world awaiting them when they came marching home."
Lawrence of Arabia,Paths of Glory,http://en.wikipedia.org/wiki/Paths_of_Glory,https://www.youtube.com/watch?v=nmDA60X-f_A,The futility and irony of the war in the trenches in WWI is shown as a unit commander in the French army must deal with the mutiny of his men and a glory-seeking general after part of his force falls back under fire in an impossible attack.
