Movie Title,Related Movie Title,Wikipedia URL,YouTube URL,Description
Persona,Innocence,https://en.wikipedia.org/wiki/Masumiyet,https://www.youtube.com/watch?v=Y1ToPu75f6Q,Yusuf is released from prison after serving a ten-year sentence. He is scared of life outside as he goes to an address given to him by another prisoner.
Persona,Winter Sleep,https://en.wikipedia.org/wiki/Winter_Sleep_(film),https://www.youtube.com/watch?v=F2_H9b0H4d0,"Aydin, a former actor, runs a small hotel in central Anatolia with his young wife Nihal with whom he has a stormy relationship and his sister Necla who is suffering from her recent divorce. In winter as the snow begins to fall, the hotel turns into a shelter but also an inescapable place that fuels their animosities..."
Persona,The Bandit,https://en.wikipedia.org/wiki/The_Bandit_(1996_film),https://www.youtube.com/watch?v=k6L8EiVf39w,"The epic adventures of the legendary Baran the Bandit following his release from prison. After serving 35 years, it is no surprise that the world has changed dramatically. Still, Baran can't help but be shocked to discover that his home village is now underwater thanks to the construction of a new dam. He then heads for Istanbul to get revenge upon his former best friend, the man who snitched on him and stole his lover Keje. Along the way, Baran teams up with Cumali, a tough young punk who finds the thief's old-fashioned ways rather quaint. When Cumali gets into deep trouble with a crime boss, Baran adds another vengeful task to his roster."
Persona,Ivy,https://en.wikipedia.org/wiki/Ivy_(1947_film),https://www.youtube.com/watch?v=yDQqoKaC4OI,"When the crew of a bankrupt cargo ship gets stuck on board for months, isolation breeds pressures that sink the men into a sea of madness and terror."
Persona,Making of the Wild Pear Tree,,,"Sinai returns from his study in the city of Canakkale to his parents' home in the small rural town of Can. He hopes to publish a book of essays and short stories. But his teacher father Idris is an addictive gambler, so much so that his mother and sister have become reluctantly accustomed to making do without food or electricity."
Persona,Three Colors: Red,https://en.wikipedia.org/wiki/Three_Colors_trilogy,https://www.youtube.com/watch?v=RPLpbDFQZpg,"Valentine is a young model living in Geneva. Because of a dog she ran over, she meets a retired judge who spies his neighbours' phone calls, not for money but to feed his cynicism. The film is the story of relationships between some human beings, Valentine and the judge, but also other people who may not be aware of the relationship they have with Valentine or/and the old judge. Redemption, forgiveness and compassion..."
Persona,Inside,https://en.wikipedia.org/wiki/Inside_(2013_film),https://www.youtube.com/watch?v=ATWtBce9x-c,"A man's life, thoughts, feelings and his very own darkness... Adapted from Dostoevsky's novel ""Notes from Undergroud"", Demirkubuz follows Muharrem as he gets himself invited to a party where he is not welcome, just to find himself disgusted."
Persona,Distant,https://en.wikipedia.org/wiki/Uzak,https://www.youtube.com/watch?v=YJKIypY3P-g,"Mahmut, a 40 year old independent photographer, is a ""village boy made good"" at least professionally in the big city - Istanbul in this case. After his wife leaves him, he falls into an existential crisis. Then comes his cousin Yusuf, who left his native village after a local factory closed down, effectively unemploying over half the local men. He looks to Istanbul for salvation: a job on board a ship sailing abroad, at once exciting and crucial to supporting his family in the desperately poor village. The distance between the two men is apparent at once, and becomes increasingly pronounced. Whereas Mahmut is adusted to big city life and suffers from many of its neuroses, Yusuf is a lonely, excentric country worker with annoying nervous and hygienic habits, and a sick mother back home he must somehow support. This intimate drama was filmed in the director's apartment in Istanbul, using all his furniture, appliances, rooms, car and so on as the film's props. The actor playing Yusuf is actually the director's real-life cousin, and the actor playing Mahmut is an actual friend, a non-professional actor."
Persona,Clouds of May,https://en.wikipedia.org/wiki/May%C4%B1s_S%C4%B1k%C4%B1nt%C4%B1s%C4%B1,https://www.youtube.com/watch?v=k9ysLQfoQd0,"This is a movie within movie, which is almost recursive, i.e., the movie inside looks like director Ceylan's previous movie, Kasaba. It is about the movie director, Muzaffer, going back to his hometown to make a movie using a cast of local people. While Muzaffer is around, his mother complains about simple health problems, his father is in a legal fight against the government for his land, his cousin gets out of his job to help Muzaffer who promises him to find a job in Istanbul, and his little cousin Ali tries to carry an egg in his pocket for 40 days so that he'll get the watch of his dreams. In the meantime, they get to form the cast for Muzaffer's movie as well."
Persona,Tabutta Rövasata,https://en.wikipedia.org/wiki/Somersault_in_a_Coffin,https://www.youtube.com/watch?v=FddwQj7IghM,"Mahsun is homeless and unemployed. He lives in Rumelihisari (one of the most picturesque and oldest quarters of Istanbul), and tries to stay alive with the help of local fishermen. Mahsun loves cars, he steals at nights and in the mornings he drives them back clean and well kept. He lives to emphasize the strange togetherness of possibilities and impossibilities. In this togetherness, Mahsun experiences friendship, trust, a one-way love affair and torture. He insists to survive in his open-air coffin of ancient Istanbul streets."
Persona,Three Colors: Blue,https://en.wikipedia.org/wiki/Three_Colors:_Blue,https://www.youtube.com/watch?v=Hxu6my_t4pM,"The first part of Kieslowski's trilogy on France's national motto: Liberty, Equality, and Fraternity. 'Blue' is the story of Julie who loses her husband, an acclaimed composer and her young daughter in a car accident. The film's theme of liberty is manifested in Julie's attempt to start life anew, free of personal commitments, belongings, grief or love. She intends to numb herself by withdrawing from the world and living completely independently, anonymously and in solitude in the Parisian metropolis. Despite her intentions, people from her former and present life intrude with their own needs. However, the reality created by the people who need and care about her, a surprising discovery and the music around which the film revolves heal Julie and draws her back to the land of the living."
Persona,Incendies,http://en.wikipedia.org/wiki/Incendies,https://www.youtube.com/watch?v=XJ69WnwvZhE,"A mother's last wishes send twins Jeanne and Simon on a journey to the Middle East in search of their tangled roots. Adapted from Wajdi Mouawad's acclaimed play, Incendies tells the powerful and moving tale of two young adults' voyage to the core of deep-rooted hatred, never-ending wars and enduring love."
Persona,Nausea,https://de.wikipedia.org/wiki/Zeki_Demirkubuz,https://www.youtube.com/watch?v=ueeB07222qc,"Ahmet, a prominent intellectual, lost his wife and daughter in a traffic accident which happened while he was spending the night with his lover. As a person who cares about nothing and bows to nothing, he is not much affected by this tragic event and goes on with his life. After a while, without any apparent reason, he experiences certain changes in himself and his life. Small mishaps, strange misfortunes happen one after another. He is not on good terms with the woman he loves very much anymore. He has difficulties facing life and reveals unexpected weaknesses."
Persona,Eternity and a Day,https://en.wikipedia.org/wiki/Eternity_and_a_Day,https://www.youtube.com/watch?v=7vpRDVTKREU,"Alexander, an old writer, is ill and prepared to die. He says his goodbyes and recalls his life with his wife long ago. While driving his car he saves a street kid, an illegal immigrant from Albania, from being arrested. Later in the day, by chance, he sees the same boy being abducted, and follows in his car. Although he is preoccupied with his own regrets, he puts death on hold to find a way to help the boy."
Persona,My Father and My Son,https://en.wikipedia.org/wiki/My_Father_and_My_Son,https://www.youtube.com/watch?v=KTmrUXNxwWI,"Sadik is one of the rebellious youth who has been politically active as a university student and became a left-wing journalist in the 70's, despite his father's expectations of him becoming an agricultural engineer and taking control of their family farm in an Aegean village. On the dawn of September 12, 1980, when a merciless military coup hits the country, they cannot find access to any hospital or a doctor and his wife dies while giving birth to their only child, Deniz. After a long-lasting period of torture, trials, and jail time, Sadik returns to his village with 7-8 years old Deniz, knowing that it will be hard to correct things with his father, Huseyin."
Persona,Capernaum,https://en.wikipedia.org/wiki/Capernaum_(film),https://www.youtube.com/watch?v=ULUo0048xZE,"Capernaüm (""Chaos"") tells the story of Zain (Zain al-Rafeea), a Lebanese boy who sues his parents for the ""crime"" of giving him life. The film follows Zain as he journeys from gutsy, streetwise child to hardened 12-year-old ""adult"" fleeing his negligent parents, surviving through his wits on the streets, where he meets Ethiopian migrant worker Rahil, who provides him with shelter and food, as Zain takes care of her baby son Yonas in return. Zain later gets jailed for committing a violent crime, and finally seeks justice in a courtroom."
Persona,Time to Love,https://tr.wikipedia.org/wiki/Sevmek_Zaman%C4%B1,https://www.youtube.com/watch?v=bdag7jkxquY,"The setting is one of the Princes' Islands, where the days are rainy and full of longing. Poor but proud painter Halil gets a job in one of the island's villas. There, he encounters the photograph of a beautiful woman, and falls in love with her image."
Persona,Itiraf,https://en.wikipedia.org/wiki/The_Confession_(2002_film),https://www.youtube.com/watch?v=vOJias_nfRo,"An engineer in his late thirties, Harun, suspects his wife, Nilgün, of being unfaithful. When the uncertainty becomes unbearable, he cuts short a business trip to Istanbul and abruptly returns home to Ankara, unannounced. They have a night of confrontation."
Persona,Destiny,https://en.wikipedia.org/wiki/Destiny_(2006_film),https://www.youtube.com/watch?v=mUDfr61XuHo,"Bekir is a young man who runs his father's business. He becomes infatuated with Ugur after she visits his shop one day. However she is in love with Zagor, a violent criminal. In a brawl Zagor kills the 'protector' of the family of Ugur and runs away with Ugur. After two subsequent murders he gets caught and Ugur asks for Zagor's help. She becomes a singer - whore and starts living from city to city following Zagor who is in prison, while Bekir follows her despite the fact that in the meantime he got married and has a child."
Do the Right Thing,Crooklyn,http://en.wikipedia.org/wiki/Crooklyn,https://www.youtube.com/watch?v=KnYl1TfWD-U,"Co-written with siblings Joie and Cinqué Lee, Spike Lee's CROOKLYN is a semi-autobiographical portrait illuminating the life of the lively Carmichael family and their vibrant Bedford-Stuyvesant community. Schoolteacher and loving Carmichael matriarch Carolyn (Alfre Woodard) runs a no-nonsense household, working hard to keep the lights on and raise her nine-year-old daughter Troy (Zelda Harris) alongside her 4 rowdy brothers with little help from her sensitive, struggling jazz-musician husband Woody (Delroy Lindo). Troy proves adept at holding her own while navigating adolescence amid the fertile chaos of one dynamic Brooklyn summer in 1973. Joie Lee conceived the high-spirited CROOKLYN screenplay as a lyrical celebration of her Brooklyn childhood and, together with her brothers, helped develop her story in honor of their mother who died when Joie was 14 years old. Featuring one of the best soundtracks of the 90s, co-starring music from the Stylistics, Sly and the Family Stone, the Staple Singers, Johnny Nash, Curtis Mayfield, Cymande, the Chambers Brothers, the J.B.'s, The Delfonics, the Jimi Hendrix Experience and so much more."
Do the Right Thing,Bamboozled,http://en.wikipedia.org/wiki/Bamboozled,https://www.youtube.com/watch?v=u_6_c2wY_Hs,"Dark, biting satire of the television industry, focusing on an Ivy League educated black writer at a major network. Frustrated that his ideas for a ""Cosby Show""-esque take on the black family have been rejected by network brass, he devises an outlandish scheme: reviving the minstrel show. This is the hook: Instead of white actors in black face, the show stars black actors in even blacker face. The show becomes an instant smash, but with the success also come repercussions for all involved."
Do the Right Thing,Girl 6,https://en.wikipedia.org/wiki/Girl_6,https://www.youtube.com/watch?v=EH_vU3mSszw,"This Spike Lee film examines the life of an aspiring actress in New York who becomes upset by the treatment of women in the film industry during one of her screen tests with 'QT.' Out of work and desperate for money, she takes a job as a phone-sex operator. Her female boss is kind, caring, and sensitive--quite a difference from her previous potential employers. Later she gets too engrossed in her work and starts to lose touch with reality, represented by her friend and neighbor Jimmy."
Do the Right Thing,She's Gotta Have It,https://en.wikipedia.org/wiki/She%27s_Gotta_Have_It,https://www.youtube.com/watch?v=BrK4-lAhkeg,"The story of Nola Darling's simultaneous sexual relationships with three different men is told by her and by her partners and other friends. All three men wanted her to commit solely to them; Nola resists being ""owned"" by a single partner."
Do the Right Thing,Friday,http://en.wikipedia.org/wiki/Friday_(1995_film),https://www.youtube.com/watch?v=umvFBoLOOgo,"It is Friday and Craig Jones (Ice Cube) is unemployed, having been fired yesterday. This has lead to trouble with Smokey's (Chris Tucker's) supplier, Big Worm (Faizon Love), who now wants his money, or his product back, or Smokey is a dead man. Then there's Deebo (Tommy ""Tiny"" Lister, Jr.), the local bully, plus Craig's jealous, psychotic girlfriend, Joi (Paula Jai Parker), and Debbie (Nia Long), the neighbor Craig has a crush on. A lot can happen while lounging around your house on a Friday."
Do the Right Thing,Short Cuts,http://en.wikipedia.org/wiki/Short_Cuts,https://www.youtube.com/watch?v=YK_PoMY0MOw,"While helicopters overhead spray against a Medfly infestation a group of Los Angeles lives intersect, some casually, some to more lasting effect. Whilst they go out to concerts and jazz clubs and even have their pools cleaned, they also lie, drink, and cheat. Death itself seems never to be far away, even on a fishing trip."
Do the Right Thing,The Comedy,http://en.wikipedia.org/wiki/The_Comedy_(film),https://www.youtube.com/watch?v=CGo9BEyASes,"Indifferent to the notion of inheriting his father's estate, a restless, aging New Yorker passes time with his friends in games of mock sincerity and irreverence."
Do the Right Thing,Losing Ground,https://en.wikipedia.org/wiki/Losing_Ground_(1982_film),https://www.youtube.com/watch?v=SKcg4QMaoIg,"A comedy-drama about a Black American female philosophy professor and her insensitive, philandering, and flamboyant artist husband who are having a marital crisis. When the wife goes off on an almost unbelievable journey to find ""ecstasy"", her husband is forced to see her in a different light."
Do the Right Thing,Clockers,http://en.wikipedia.org/wiki/Clockers_(film),https://www.youtube.com/watch?v=YsFUoioGePc,"Strike is a young city drug pusher under the tutelage of drug-lord Rodney Little, who, when not playing with model trains or drinking Moo for his ulcer, just likes to chill with his brothers near the benches outside the project houses. When a night man at a fast-food restaurant is found with four bullets in his body, Strike's older brother turns himself in as the killer. Det. Rocco Klein doesn't buy the story, however, and sets out to find the truth, and it seems that all the fingers point toward Strike & Rodney."
Do the Right Thing,Citizen Ruth,http://en.wikipedia.org/wiki/Citizen_Ruth,https://www.youtube.com/watch?v=oIb4KbnMQ38,"Ruth Stoops is a poor indigent drug-user (a huffer - inhaling glue and paint for a high) whose down and out existence is complicated once more by becoming pregnant (she has had and lost four children already). When a judge orders that she gets an abortion or face a felony charge, she is befriended by Gail Stoney, a pro-lifer whose husband is president of the local ""Babysavers"" group. Suddenly Ruth is thrust into the middle of the pro-choice/pro-life struggle, with each side wanting her to take their side as a ""message"" to others - and the situation escalates..."
Do the Right Thing,Stranger Than Paradise,http://en.wikipedia.org/wiki/Stranger_Than_Paradise,https://www.youtube.com/watch?v=UxHMREKn9fs,"A self-styled New York hipster is paid a surprise visit by his younger cousin from Budapest. From initial hostility and indifference a small degree of affection grows between the two. Along with a friend, they eventually end up visiting their aunt in the wastelands of Cleveland and then proceed to Florida where they lose all their money gambling before unwittingly gaining a fortune."
Do the Right Thing,Slacker,https://en.wikipedia.org/wiki/Slacker_(film),https://www.youtube.com/watch?v=KlmfRuXxuXo,"Presents a day in the life in Austin, Texas among its social outcasts and misfits, predominantly the twenty-something set, using a series of linear vignettes. These characters, who in some manner just don't fit into the establishment norms, move seamlessly from one scene to the next, randomly coming and going into one another's lives. Highlights include a UFO buff who adamantly insists that the U.S. has been on the moon since the 1950s, a woman who produces a glass slide purportedly of Madonna's pap smear, and an old anarchist who sympathetically shares his philosophy of life with a robber."
Do the Right Thing,Jungle Fever,http://en.wikipedia.org/wiki/Jungle_Fever,https://www.youtube.com/watch?v=PrTlgjhDyhw,A successful and married black man contemplates having an affair with a white girl from work. He's quite rightly worried that the racial difference would make an already taboo relationship even worse.
Do the Right Thing,After Hours,http://en.wikipedia.org/wiki/After_Hours_(film),https://www.youtube.com/watch?v=OZzb_6LtMjY,"A meek word processor in New York impulsively travels downtown to Soho for date with an attractive, but apparently disturbed young woman, and finds himself trapped in a nightmarishly surreal vortex of improbable coincidences and farcical circumstances."
Do the Right Thing,Daddy Longlegs,https://en.wikipedia.org/wiki/Daddy_Longlegs_(2009_film),https://www.youtube.com/watch?v=NpQbnh8o810,"After months of being alone, sad, busy, sidetracked, free, lofty, late and away from his kids, Lenny, 34 with graying frazzled hair, picks his kids up from school. Every year he spends a couple of weeks with his sons Sage, 9, and Frey, 7. Lenny juggles his kids and everything else all within a midtown studio apartment in New York City. He ultimately faces the choice of being their father or their friend all with the idea that these two weeks must last 6 months. In these two weeks, a trip upstate, visitors from strange lands, a mother, a girlfriend, ""magic"" blankets, and complete lawlessness seem to take over their lives. The film is a swan song to excuses and responsibilities; to fatherhood and self-created experiences, and to what it's like to be truly torn between being a child and being an adult."
Do the Right Thing,School Daze,http://en.wikipedia.org/wiki/School_daze,https://www.youtube.com/watch?v=snxtT7xr-nY,In the South of the United States are taking place confrontations between two groups of students who have different ideas and are not able to accept the one of the opponent.
Do the Right Thing,Foolish,https://en.wikipedia.org/wiki/Foolish_(film),https://www.youtube.com/watch?v=NoDqEyHsxsw,"Eddie Griffin is Miles Waise, a fast rising nightclub comedian. His life is made difficult by his manager, who wants him to sell out for big bucks, and his brother Fifty Dollah, a scheming hood whose dream is to start a comedy club with Foolish."
Do the Right Thing,Adaptation.,http://en.wikipedia.org/wiki/Adaptation_(film),https://www.youtube.com/watch?v=c6woPWN7X5U,While his latest movie
Do the Right Thing,Naked,https://en.wikipedia.org/wiki/Naked_(1993_film),https://www.youtube.com/watch?v=g1axEqfItxg,"Johnny flees Manchester for London, to avoid a beating from the family of a girl he has raped. There he finds an old girlfriend, and spends some time homeless, spending much of his time ranting at strangers, and meeting characters in plights very much like his own."
Do the Right Thing,Hangin' with the Homeboys,https://en.wikipedia.org/wiki/Hangin%27_with_the_Homeboys,https://www.youtube.com/watch?v=l2qUS83qL-U,"Two African-Americans and two Puerto-Ricans (though one pretends to be Italian) go out on the town on a Friday night. They will be forced to get to know each other, and even worse, learn to like each other as friends."
Rashomon,Weathering with You,https://en.wikipedia.org/wiki/Weathering_with_You,https://www.youtube.com/watch?v=Q6iK6DjV_iE,A high-school boy who has run away to Tokyo befriends a girl who appears to be able to manipulate the weather.
Rashomon,Ride Your Wave,https://en.wikipedia.org/wiki/Ride_Your_Wave,https://www.youtube.com/watch?v=OOEpST-PHh8,"Hinako is a surf-loving college student who has just moved to a small seaside town. When a sudden fire breaks out at her apartment building, she is rescued by Minato, a handsome firefighter, and the two soon fall in love. Just as they become inseparable, Minato loses his life in an accident at sea. Hinako is so distraught that she can no longer even look at the ocean, but one day she sings a song that reminds her of their time together, and Minato appears in the water. From then on, she can summon him in any watery surface as soon as she sings their song, but can the two really remain together forever? And what is the real reason for Minato's sudden reappearance?"
Rashomon,A Whisker Away,https://en.wikipedia.org/wiki/A_Whisker_Away,https://www.youtube.com/watch?v=aXc9DVfLTGo,"Miyo Sasaki is a weird second-year junior high student, who falls in love with her classmate Kento Hinode. Muge tries to make Kento notice her every day, but all in vain. Nevertheless, while carrying a secret she can tell no one, Muge continues to pursue Kento. Muge discovers a magic mask that allows her to transform into a cat, however, there is also a probability that she might never become human again, if she continues using the mask."
Rashomon,Your Name.,https://en.wikipedia.org/wiki/Your_Name,https://www.youtube.com/watch?v=xU47nhruN-Q,Mitsuha is the daughter of the mayor of a small mountain town. She's a straightforward high school girl who lives with her sister and her grandmother and has no qualms about letting it be known that she's uninterested in Shinto rituals or helping her father's electoral campaign. Instead she dreams of leaving the boring town and trying her luck in Tokyo. Taki is a high school boy in Tokyo who works part-time in an Italian restaurant and aspires to become an architect or an artist. Every night he has a strange dream where he becomes...a high school girl in a small mountain town.
Rashomon,Hello World,https://en.wikipedia.org/wiki/Hello_World_(film),https://www.youtube.com/watch?v=8S8nHyxlgpE,A man travels in time from the year 2027 to relive his school years and to correct a bad decision.
Rashomon,I Want to Eat Your Pancreas,https://en.wikipedia.org/wiki/I_Want_to_Eat_Your_Pancreas,https://www.youtube.com/watch?v=MmoBvmJA9XI,"One day, ""Me"" - a highschooler - found a paperback in the hospital. The ""Disease Coexistence Journal"" was its title. It was a diary that ""Me""'s classmate, Sakura Yamauchi, had written in secret. Inside, it was written that due to her pancreatic disease, her days were numbered. And thus, ""Me"" coincidentally went from Just-a-Classmate to a Secret-Knowing-Classmate. It was as if he were being drawn to her, who was his polar opposite. However, the world presented the girl that was already suffering from an illness with an equally cruel reality."
Rashomon,"The Night Is Short, Walk on Girl","https://en.wikipedia.org/wiki/Night_Is_Short,_Walk_On_Girl",https://www.youtube.com/watch?v=NDs1W25kVso,"As a group of teens go out for a night on the town, a sophomore known only as ""The Girl with Black Hair"" experiences a series of surreal encounters with the local nightlife - all the while unaware of the romantic longings of Senpai, a fellow student who has been creating increasingly fantastic and contrived reasons to run into her, in an effort to win her heart."
Rashomon,5 Centimeters per Second,https://en.wikipedia.org/wiki/5_Centimeters_Per_Second,https://www.youtube.com/watch?v=wdM7athAem0,"Takaki and Akari are two classmates in elementary school. During their time together they have become close friends. Their relationship is tested when Akari moves to another city because of her parents' jobs. Both of them struggle to keep their friendship alive, as time and distance slowly pulls them apart. When Takaki finds out that he is moving further away, he decides to visit Akari one last time."
