Movie Title,Related Movie Title,Wikipedia URL,YouTube URL,Description
The Godfather,The Godfather Part II,https://en.wikipedia.org/wiki/The_Godfather_Part_II,https://www.youtube.com/watch?v=9O1Iy9od7-A,"The continuing saga of the Corleone crime family tells the story of a young Vito Corleone growing up in Sicily and in 1910s New York; and follows Michael Corleone in the 1950s as he attempts to expand the family business into Las Vegas, Hollywood and Cuba."
The Godfather,Taxi Driver,https://en.wikipedia.org/wiki/Taxi_Driver,https://www.youtube.com/watch?v=T5IligQP7Fo,"Travis Bickle is an ex-Marine and Vietnam War veteran living in New York City. As he suffers from insomnia, he spends his time working as a taxi driver at night, watching porn movies at seedy cinemas during the day, or thinking about how the world, New York in particular, has deteriorated into a cesspool. He's a loner who has strong opinions about what is right and wrong with mankind. For him, the one bright spot in New York humanity is Betsy, a worker on the presidential nomination campaign of Senator Charles Palantine. He becomes obsessed with her. After an incident with her, he believes he has to do whatever he needs to make the world a better place in his opinion. One of his priorities is to be the savior for Iris, a twelve-year-old runaway and prostitute who he believes wants out of the profession and under the thumb of her pimp and lover Matthew."
The Godfather,The Many Saints of Newark,https://en.wikipedia.org/wiki/The_Many_Saints_of_Newark,https://www.youtube.com/watch?v=dHa95iy2lF0,"Young Anthony Soprano is growing up in one of the most tumultuous eras in Newark's history, becoming a man just as rival gangsters begin to rise up and challenge the all-powerful DiMeo crime family's hold over the increasingly race-torn city. Caught up in the changing times is the uncle he idolizes, Dickie Moltisanti, who struggles to manage both his professional and personal responsibilities and whose influence over his nephew will help make the impressionable teenager into the all-powerful mob boss we'll later come to know: Tony Soprano."
The Godfather,The King of Staten Island,https://en.wikipedia.org/wiki/The_King_of_Staten_Island,https://www.youtube.com/watch?v=azkVr0VUSTA,"Scott has been a case of arrested development ever since his firefighter father died when he was seven. He's now reached his mid-20s having achieved little, chasing a dream of becoming a tattoo artist that seems far out of reach. As his ambitious younger sister heads off to college, Scott is still living with his exhausted ER nurse mother and spends his days smoking weed, hanging with the guys - Oscar, Igor and Richie - and secretly hooking up with his childhood friend Kelsey. But when his mother starts dating a loudmouth firefighter named Ray, it sets off a chain of events that will force Scott to grapple with his grief and take his first tentative steps toward moving forward in life."
The Godfather,Scarface,http://en.wikipedia.org/wiki/Scarface_(1983_movie),https://www.youtube.com/watch?v=7pQQHnqBa2E,"Tony Montana manages to leave Cuba during the Mariel exodus of 1980. He finds himself in a Florida refugee camp but his friend Manny has a way out for them: undertake a contract killing and arrangements will be made to get a green card. He's soon working for drug dealer Frank Lopez and shows his mettle when a deal with Colombian drug dealers goes bad. He also brings a new level of violence to Miami. Tony is protective of his younger sister but his mother knows what he does for a living and disowns him. Tony is impatient and wants it all however, including Frank's empire and his mistress Elvira Hancock. Once at the top however, Tony's outrageous actions make him a target and everything comes crumbling down."
The Godfather,The Godfather Part III,https://en.wikipedia.org/wiki/The_Godfather_Part_III,https://www.youtube.com/watch?v=UUkG37KSWf0,"In the final installment of the Godfather Trilogy, an aging Don Michael Corleone seeks to legitimize his crime family's interests and remove himself from the violent underworld but is kept back by the ambitions of the young. While he attempts to link the Corleone's finances with the Vatican, Michael must deal with the machinations of a hungrier gangster seeking to upset the existing Mafioso order and a young protege's love affair with his daughter."
The Godfather,The Silence of the Lambs,http://en.wikipedia.org/wiki/The_Silence_of_the_Lambs_(film),https://www.youtube.com/watch?v=W6Mm8Sbe__o,"F.B.I. trainee Clarice Starling (Jodie Foster) works hard to advance her career, while trying to hide or put behind her West Virginia roots, of which if some knew, would automatically classify her as being backward or white trash. After graduation, she aspires to work in the agency's Behavioral Science Unit under the leadership of Jack Crawford (Scott Glenn). While she is still a trainee, Crawford asks her to question Dr. Hannibal Lecter (Sir Anthony Hopkins), a psychiatrist imprisoned, thus far, for eight years in maximum security isolation for being a serial killer who cannibalized his victims. Clarice is able to figure out the assignment is to pick Lecter's brains to help them solve another serial murder case, that of someone coined by the media as ""Buffalo Bill"" (Ted Levine), who has so far killed five victims, all located in the eastern U.S., all young women, who are slightly overweight (especially around the hips), all who were drowned in natural bodies of water, and all who were stripped of large swaths of skin. She also figures that Crawford chose her, as a woman, to be able to trigger some emotional response from Lecter. After speaking to Lecter for the first time, she realizes that everything with him will be a psychological game, with her often having to read between the very cryptic lines he provides. She has to decide how much she will play along, as his request in return for talking to him is to expose herself emotionally to him. The case takes a more dire turn when a sixth victim is discovered, this one from who they are able to retrieve a key piece of evidence, if Lecter is being forthright as to its meaning. A potential seventh victim is high profile Catherine Martin (Brooke Smith), the daughter of Senator Ruth Martin (Diane Baker), which places greater scrutiny on the case as they search for a hopefully still alive Catherine. Who may factor into what happens is Dr. Frederick Chilton (Anthony Heald), the warden at the prison, an opportunist who sees the higher profile with Catherine, meaning a higher profile for himself if he can insert himself successfully into the proceedings."
The Godfather,12 Angry Men,https://en.wikipedia.org/wiki/12_Angry_Men_(1957_film),https://www.youtube.com/watch?v=TEN-2uTi2c0,"The defense and the prosecution have rested, and the jury is filing into the jury room to decide if a young man is guilty or innocent of murdering his father. What begins as an open-and-shut case of murder soon becomes a detective story that presents a succession of clues creating doubt, and a mini-drama of each of the jurors' prejudices and preconceptions about the trial, the accused, AND each other. Based on the play, all of the action takes place on the stage of the jury room."
The Godfather,Hustlers,https://en.wikipedia.org/wiki/Hustlers_(2019_film),https://www.youtube.com/watch?v=P_dfc0iqmig,"Inspired by the viral New York Magazine article, Hustlers follows a crew of savvy former strip club employees who band together to turn the tables on their Wall Street clients."
The Godfather,Forrest Gump,http://en.wikipedia.org/wiki/Forrest_Gump,https://www.youtube.com/watch?v=bLvqoHBptjg,"Forrest Gump is a simple man with a low I.Q. but good intentions. He is running through childhood with his best and only friend Jenny. His 'mama' teaches him the ways of life and leaves him to choose his destiny. Forrest joins the army for service in Vietnam, finding new friends called Dan and Bubba, he wins medals, creates a famous shrimp fishing fleet, inspires people to jog, starts a ping-pong craze, creates the smiley, writes bumper stickers and songs, donates to people and meets the president several times. However, this is all irrelevant to Forrest who can only think of his childhood sweetheart Jenny Curran, who has messed up her life. Although in the end all he wants to prove is that anyone can love anyone."
The Godfather,The God Committee,https://en.wikipedia.org/wiki/The_God_Committee,https://www.youtube.com/watch?v=p8J9QmN5iaE,"As a donor heart arrives at a New York hospital, the intended recipient dies. Due to this unexpected crisis, an organ transplant committee must convene within one hour to decide which of three other patients currently waiting for a transplant deserves the life-saving heart. God's work is now left in the hands of five doctors, including Boxer (Kelsey Grammer), a cynical but brilliant heart surgeon; Jordan (Julia Stiles), an idealistic up-and-comer; and Gilroy (Janeane Garofalo), a weary bureaucrat. As the debate over the heart heats up, ethics and bribes clash, leaving the committee members to question what's more valuable: morals or money?"
The Godfather,Casino,http://en.wikipedia.org/wiki/Casino_(movie),https://www.youtube.com/watch?v=EJXDMwGWhoA,"This Martin Scorsese film depicts the Janus-like quality of Las Vegas--it has a glittering, glamorous face, as well as a brutal, cruel one. Ace Rothstein and Nicky Santoro, mobsters who move to Las Vegas to make their mark, live and work in this paradoxical world. Seen through their eyes, each as a foil to the other, the details of mob involvement in the casinos of the 1970s and '80s are revealed. Ace is the smooth operator of the Tangiers casino, while Nicky is his boyhood friend and tough strongman, robbing and shaking down the locals. However, they each have a tragic flaw--Ace falls in love with a hustler, Ginger, and Nicky falls into an ever-deepening spiral of drugs and violence."
The Godfather,The Departed,http://en.wikipedia.org/wiki/The_Departed,https://www.youtube.com/watch?v=iQpb1LoeVUc,"In this crime-action tour de force, the South Boston state police force is waging war on Irish-American organized crime. Young undercover cop Billy Costigan is assigned to infiltrate the mob syndicate run by gangland chief Frank Costello. While Billy quickly gains Costello's confidence, Colin Sullivan, a hardened young criminal who has infiltrated the state police as an informer for the syndicate is rising to a position of power in the Special Investigation Unit. Each man becomes deeply consumed by their double lives, gathering information about the plans and counter-plans of the operations they have penetrated. But when it becomes clear to both the mob and the police that there is a mole in their midst, Billy and Colin are suddenly in danger of being caught and exposed to the enemy - and each must race to uncover the identity of the other man in time to save themselves. But is either willing to turn on their friends and comrades they've made during their long stints undercover?"
The Godfather,American History X,http://en.wikipedia.org/wiki/American_History_X,https://www.youtube.com/watch?v=XfQYHqsiN5g,"Derek Vineyard is paroled after serving 3 years in prison for brutally killing two black men who tried to break into/steal his truck. Through his brother's, Danny Vineyard, narration, we learn that before going to prison, Derek was a skinhead and the leader of a violent white supremacist gang that committed acts of racial crime throughout L.A. and his actions greatly influenced Danny. Reformed and fresh out of prison, Derek severs contact with the gang and becomes determined to keep Danny from going down the same violent path as he did."
The Godfather,Once Upon a Time... in Hollywood,https://en.wikipedia.org/wiki/Once_Upon_a_Time_in_Hollywood,https://www.youtube.com/watch?v=ELeMaP8EPAA,"Quentin Tarantino's Once Upon a Time... in Hollywood visits 1969 Los Angeles, where everything is changing, as TV star Rick Dalton (Leonardo DiCaprio) and his longtime stunt double Cliff Booth (Brad Pitt) make their way around an industry they hardly recognize anymore. The ninth film from the writer-director features a large ensemble cast and multiple storylines in a tribute to the final moments of Hollywood's golden age."
The Godfather,Good Will Hunting,http://en.wikipedia.org/wiki/Good_Will_Hunting,https://www.youtube.com/watch?v=ReIJ1lbL-Q8,"A touching tale of a wayward young man who struggles to find his identity, living in a world where he can solve any problem, except the one brewing deep within himself, until one day he meets his soul mate who opens his mind and his heart."
The Godfather,Pulp Fiction,https://en.wikipedia.org/wiki/Pulp_Fiction,https://www.youtube.com/watch?v=s7EdQ4FqbhY,Jules Winnfield (
The Godfather,Fight Club,http://en.wikipedia.org/wiki/Fight_Club_(film),https://www.youtube.com/watch?v=qtRKdVHc-cE,A nameless first person narrator (
The Godfather,Late Night,https://en.wikipedia.org/wiki/Late_Night_(film),https://www.youtube.com/watch?v=DxefiCjQirw,"Katherine Newbury (Dame Emma Thompson) is a pioneer and legendary host on the late-night talk-show circuit. When she's accused of being a ""woman who hates women"", she puts affirmative action on the to-do list, and presto. Molly (Mindy Kaling) is hired as the one woman in Katherine's all-male writers' room. But Molly might be too little, too late, as the formidable Katherine also faces the reality of low ratings and a network that wants to replace her. Wanting to prove she's not merely a diversity hire who's disrupting the comfort of the brotherhood, Molly is determined to help Katherine revitalize her show and career--and possibly effect even bigger change at the same time."
The Godfather,The Usual Suspects,https://en.wikipedia.org/wiki/The_Usual_Suspects,https://www.youtube.com/watch?v=oiXdPolca5w,"Following a truck hijack in New York, five criminals are arrested and brought together for questioning. As none of them are guilty, they plan a revenge operation against the police. The operation goes well, but then the influence of a legendary mastermind criminal called Keyser Söze is felt. It becomes clear that each one of them has wronged Söze at some point and must pay back now. The payback job leaves 27 men dead in a boat explosion, but the real question arises now: Who actually is Keyser Söze?"
Citizen Kane,BlacKkKlansman,https://en.wikipedia.org/wiki/BlacKkKlansman,https://www.youtube.com/watch?v=pFc6I0rgmgY,"In the early 1970s,"
Citizen Kane,Taxi Driver,https://en.wikipedia.org/wiki/Taxi_Driver,https://www.youtube.com/watch?v=T5IligQP7Fo,"Travis Bickle is an ex-Marine and Vietnam War veteran living in New York City. As he suffers from insomnia, he spends his time working as a taxi driver at night, watching porn movies at seedy cinemas during the day, or thinking about how the world, New York in particular, has deteriorated into a cesspool. He's a loner who has strong opinions about what is right and wrong with mankind. For him, the one bright spot in New York humanity is Betsy, a worker on the presidential nomination campaign of Senator Charles Palantine. He becomes obsessed with her. After an incident with her, he believes he has to do whatever he needs to make the world a better place in his opinion. One of his priorities is to be the savior for Iris, a twelve-year-old runaway and prostitute who he believes wants out of the profession and under the thumb of her pimp and lover Matthew."
Citizen Kane,Casino,http://en.wikipedia.org/wiki/Casino_(movie),https://www.youtube.com/watch?v=EJXDMwGWhoA,"This Martin Scorsese film depicts the Janus-like quality of Las Vegas--it has a glittering, glamorous face, as well as a brutal, cruel one. Ace Rothstein and Nicky Santoro, mobsters who move to Las Vegas to make their mark, live and work in this paradoxical world. Seen through their eyes, each as a foil to the other, the details of mob involvement in the casinos of the 1970s and '80s are revealed. Ace is the smooth operator of the Tangiers casino, while Nicky is his boyhood friend and tough strongman, robbing and shaking down the locals. However, they each have a tragic flaw--Ace falls in love with a hustler, Ginger, and Nicky falls into an ever-deepening spiral of drugs and violence."
Citizen Kane,Dog Day Afternoon,http://en.wikipedia.org/wiki/Dog_Day_Afternoon,https://www.youtube.com/watch?v=Ne6KMHLTvik,"Based upon a real-life incident which occurred in August 1972 in which a Chase Manhattan Bank branch in Gravesend, Brooklyn, New York, was held siege by Sonny, a Vietnam veteran turned bank robber determined to steal enough money ($2500) for his ""wife"" (Leon, a man; the two, were, according to an onscreen TV news report, married in a church by a priest who was defrocked shortly after, although Leon says to the police that Sal is ""married and has children"") to undergo a sex change operation. (The real life character upon whom Leon is based did, in fact, get the operation.) On a hot summer afternoon, Sonny and two cohort, Stevie and Sal, go to rob the (fictional) First Savings Bank of Brooklyn. Stevie soon gets nervous and flees. Although the bank manager and female tellers agree not to interfere with the robbery, Sonny finds there is not much to steal, as most of the cash has been picked up for the day. Sonny then gets an unexpected phone call from Captain Moretti of the NYPD, who tells him the place is surrounded by the city's entire police force. Having few options under the circumstances, Sonny nervously bargains with Moretti, demanding safe escort to the airport and a plane out of the country in return for the bank employees' safety."
Citizen Kane,American History X,http://en.wikipedia.org/wiki/American_History_X,https://www.youtube.com/watch?v=XfQYHqsiN5g,"Derek Vineyard is paroled after serving 3 years in prison for brutally killing two black men who tried to break into/steal his truck. Through his brother's, Danny Vineyard, narration, we learn that before going to prison, Derek was a skinhead and the leader of a violent white supremacist gang that committed acts of racial crime throughout L.A. and his actions greatly influenced Danny. Reformed and fresh out of prison, Derek severs contact with the gang and becomes determined to keep Danny from going down the same violent path as he did."
Citizen Kane,Scarface,http://en.wikipedia.org/wiki/Scarface_(1983_movie),https://www.youtube.com/watch?v=7pQQHnqBa2E,"Tony Montana manages to leave Cuba during the Mariel exodus of 1980. He finds himself in a Florida refugee camp but his friend Manny has a way out for them: undertake a contract killing and arrangements will be made to get a green card. He's soon working for drug dealer Frank Lopez and shows his mettle when a deal with Colombian drug dealers goes bad. He also brings a new level of violence to Miami. Tony is protective of his younger sister but his mother knows what he does for a living and disowns him. Tony is impatient and wants it all however, including Frank's empire and his mistress Elvira Hancock. Once at the top however, Tony's outrageous actions make him a target and everything comes crumbling down."
Citizen Kane,Down by Law,http://en.wikipedia.org/wiki/Down_by_Law_(film),https://www.youtube.com/watch?v=7OHg4Ayewao,"DJ Zack and pimp Jack end up in prison for being too laid-back to avoid being framed for crimes they didn't commit. They end up sharing a cell with eccentric Italian optimist Roberto, whose limited command of the English language is both entertaining and infuriating. More useful to them is the fact that Roberto knows an escape route."
Citizen Kane,Once Upon a Time in America,http://en.wikipedia.org/wiki/Once_Upon_A_Time_In_America,https://www.youtube.com/watch?v=LcpCRyNo8T8,"With the vivid memory of his long-gone childhood friends Max, Patsy, and Cockeye etched in his mind, his ferociously loyal partners-in-crime during their rise to prominence in New York's Prohibition-era Lower East Side, the defeated, penniless, and guilt-ridden former gangster David ""Noodles"" Aaronson returns to Manhattan. Not knowing what to expect on his mission to shed light on his opaque past, grizzled Noodles reunites with his only living friend Fat Moe after 35 haunted years of self-exile. However, the relentless, piercing sound of culpability stands in the way of finding closure, as the inscrutable content of a well-worn leather suitcase further complicates matters. And now, against the backdrop of a torn conscience, the sad, bittersweet recollections of more than 50 years of love, death, and everything in-between become inextricably intertwined, leading to even more puzzling questions. But what are a man's options when he is left with nothing?"
Citizen Kane,Do the Right Thing,http://en.wikipedia.org/wiki/Do_the_Right_Thing,https://www.youtube.com/watch?v=yVAD4fYRcvA,"This film looks at life in the Bedford-Stuyvesant district of Brooklyn on a hot summer Sunday. As he does everyday, Sal Fragione opens the pizza parlor he's owned for 25 years. The neighborhood has changed considerably in the time he's been there and is now composed primarily of African-Americans and Hispanics. His son Pino hates it there and would like nothing better than to relocate the eatery to their own neighborhood. For Sal however, the restaurant represents something that is part of his life and sees it as a part of the community. What begins as a simple complaint by one of his customers, Buggin Out - who wonders why he has only pictures of famous Italian-Americans on the wall when most of his customers are black - eventually disintegrates into violence as frustration seemingly brings out the worst in everyone."
Citizen Kane,White Boy Rick,https://en.wikipedia.org/wiki/White_Boy_Rick,https://www.youtube.com/watch?v=qns48PtK2io,"Set in 1980s Detroit at the height of the crack epidemic and the War on Drugs, WHITE BOY RICK is based on the moving story of a blue-collar father and his teenage son, Rick Wershe Jr., who became an undercover police informant and later a drug dealer, before he was abandoned by his handlers."
Citizen Kane,The Sting,http://en.wikipedia.org/wiki/The_Sting,https://www.youtube.com/watch?v=_nAIb_J9T5M,"Johnny Hooker, a small time grifter, unknowingly steals from Doyle Lonnegan, a big time crime boss, when he pulls a standard street con. Lonnegan demands satisfaction for the insult. After his partner, Luther, is killed, Hooker flees, and seeks the help of Henry Gondorff, one of Luther's contacts, who is a master of the long con. Hooker wants to use Gondorff's expertise to take Lonnegan for an enormous sum of money to even the score, since he admits he ""doesn't know enough about killing to kill him."" They devise a complicated scheme and amass a talented group of other con artists who want their share of the reparations. The stakes are high in this game, and our heroes must not only deal with Lonnegan's murderous tendencies, but also other side players who want a piece of the action. To win, Hooker and Gondorff will need all their skills...and a fair amount of confidence."
Citizen Kane,Paper Moon,http://en.wikipedia.org/wiki/Paper_Moon_(film),https://www.youtube.com/watch?v=QDVQOaphlHU,"Set in the midwest of the depression-era, Paper Moon follows Moses Pray and Addie Loggins - one a con artist, the other, the young girl who's the daughter of a woman who's just passed away. The pair meet when 'Mose' stops by the sparsely-attended funeral in Kansas of a woman he once knew (we never see her). In attendance, is the woman's young daughter, Addie, whom Moses agrees to transport to St Joseph, Mo -- for money, of course. Mose - an inveterate hustler, has been working ostensibly as a representative of the Kansas Bible Company - who picks his marks from the obits, and tries to sell - at exorbitant prices - the decedents' spouse the custom bible they'd previously ordered. Wise beyond her years, Addie picks up on Moses' grift, and very quickly, she and Mose become a team. Traveling from town to town, making money in every dishonest way imaginable, and looking for the ultimate score. The colorful characters they meet along the way make the film all the more interesting. One in particular - Miss Trixie Delight - an exotic dancer who Mose rescues from a traveling carnival and the girl who works for her, poor, suffering Imogene. Addie sees Miss Delight as a potential rival, and she concocts a plan with Imogene to free themselves of her. The film's peppered with regional dialogue, one of the most memorable line's uttered when Mose is forced to wrestle a backwoodsman in order to trade his new car for the hillbilly's battered old truck; ""make him say calf-rope, Leroy!"" one of the observers calls out. Paper Moon, directed by Peter Bogdonovich is adapted from the novel, ""Addie Pray"" (1971) by Joe David Brown."
Citizen Kane,To Kill a Mockingbird,http://en.wikipedia.org/wiki/To_Kill_a_Mockingbird_(film),https://www.youtube.com/watch?v=KR7loA_oziY,"Small-town Alabama, 1932. Atticus Finch (played by Gregory Peck) is a lawyer and a widower. He has two young children, Jem and Scout. Atticus Finch is currently defending Tom Robinson, a black man accused of raping a white woman. Meanwhile, Jem and Scout are intrigued by their neighbours, the Radleys, and the mysterious, seldom-seen Boo Radley in particular."
Citizen Kane,Dolemite Is My Name,https://en.wikipedia.org/wiki/Dolemite_Is_My_Name,https://www.youtube.com/watch?v=Ws1YIKsuTjQ,
